{
  "version": "1.0",
  "ok": true,
  "fallback": false,
  "message": "",
  "data": {
    "steps": [
      {
        "instruction": "Head north on the street",
        "maneuver": "start",
        "distance_m": 120,
        "end": {
          "lat": 30.0447,
          "lon": 31.2359
        }
      },
      {
        "instruction": "Turn right",
        "maneuver": "turn_right",
        "distance_m": 80,
        "end": {
          "lat": 30.0452,
          "lon": 31.2368
        }
      },
      {
        "instruction": "The pharmacy is on your left",
        "maneuver": "arrive",
        "distance_m": 0,
        "end": {
          "lat": 30.0452,
          "lon": 31.2368
        }
      }
    ],
    "polyline": "_p~iF~ps|U_ulLnnqC",
    "distance_m": 200,
    "duration_s": 160,
    "destination_name": "Pharmacy (example)"
  },
  "request_id": "req_route_1",
  "error": null
}
